{
  "schemaVersion": "1.0.0",
  "batchId": "template-batch-replace-me",
  "title": "Template — prochain lot nutritionnel approuvé",
  "status": "draft",
  "approvedBy": "KR Kinetics",
  "approvedAt": "YYYY-MM-DD",
  "purpose": "Copier ce fichier, renseigner les aliments, puis valider / prévisualiser / appliquer via le moteur générique.",
  "scope": {
    "existingFoodCount": 208,
    "newFoodCount": 1,
    "expectedFinalFoodCount": 209,
    "pilotFoodCount": 2,
    "protectedFoodCount": 207,
    "allowedFoodIds": [
      "example-food-id",
      "example-manufacturer-food-id"
    ]
  },
  "sourcePolicy": {
    "genericFoods": {
      "preferredSource": "Canadian Nutrient File 2026",
      "publisher": "Health Canada",
      "datasetId": "1b6139bd-ed7e-4043-bc28-ff00e10f3109",
      "portalPage": "https://open.canada.ca/data/en/dataset/1b6139bd-ed7e-4043-bc28-ff00e10f3109"
    },
    "brandedFoods": {
      "preferredSource": "Official manufacturer nutrition page"
    }
  },
  "roundingPolicy": {
    "storedMacrosG": "Arrondir à 0,1 g.",
    "storedKcal": "Arrondir à l'entier le plus proche.",
    "zeroRule": "Une valeur confirmée inférieure à 0,05 g s'affiche 0 g; une valeur inconnue reste null."
  },
  "foods": [
    {
      "operation": "update",
      "id": "example-food-id",
      "lockedIdentity": {
        "fr": "Exemple FR",
        "en": "Example EN",
        "preparationState": "raw",
        "exclusions": ["frozen"]
      },
      "canonicalPortion": {
        "labelFr": "100 g",
        "labelEn": "100 g",
        "amount": 100,
        "unit": "g",
        "grams": 100
      },
      "sourcePlan": {
        "adapter": "cnf_2026",
        "expectedRecordId": "RECORD_ID_REQUIRED",
        "matchKeywordsEn": ["example"],
        "mustContainConcepts": ["example"],
        "mustNotContainConcepts": ["frozen"],
        "ambiguityRule": "Choisir l'enregistrement générique correspondant à l'identité verrouillée."
      },
      "classification": {
        "displayCategory": "fruits",
        "calculationGroup": "fruit",
        "exchangeProfileId": "fruit-standard",
        "classificationStatus": "approved"
      }
    },
    {
      "operation": "add",
      "id": "example-manufacturer-food-id",
      "lockedIdentity": {
        "fr": "Exemple fabricant FR",
        "en": "Manufacturer example EN",
        "preparationState": "dry_uncooked",
        "brand": "Example Brand"
      },
      "canonicalPortion": {
        "labelFr": "0,5 scoop (20 g)",
        "labelEn": "0.5 scoop (20 g)",
        "amount": 0.5,
        "unit": "scoop",
        "grams": 20
      },
      "manufacturerLabel": {
        "sourceType": "manufacturer_website",
        "url": "https://example.com/product",
        "accessedAt": "YYYY-MM-DD",
        "brand": "Example Brand",
        "productName": "Example Protein",
        "market": "North America",
        "labelServing": { "amount": 1, "unit": "scoop", "grams": 40 },
        "labelNutrients": {
          "declaredKcal": 140,
          "proteinG": 30,
          "carbsG": 3,
          "fiberG": 0,
          "fatG": 1,
          "saturatedFatG": 0.5,
          "polyunsaturatedFatG": null,
          "monounsaturatedFatG": null
        },
        "derivedUnroundedForCanonicalPortion": {
          "declaredKcal": 70,
          "proteinG": 15,
          "carbsG": 1.5,
          "fiberG": 0,
          "fatG": 0.5,
          "saturatedFatG": 0.25,
          "polyunsaturatedFatG": null,
          "monounsaturatedFatG": null
        },
        "storedForCanonicalPortion": {
          "declaredKcal": 70,
          "proteinG": 15,
          "carbsG": 1.5,
          "fiberG": 0,
          "fatG": 0.5,
          "saturatedFatG": 0.3,
          "polyunsaturatedFatG": null,
          "monounsaturatedFatG": null
        }
      },
      "classification": {
        "displayCategory": "autres_sources_proteinees",
        "calculationGroup": "protein",
        "exchangeProfileId": "protein-manufacturer-example",
        "classificationStatus": "approved"
      }
    }
  ],
  "acceptanceCriteria": [
    "Les aliments hors lot restent inchangés.",
    "Aucune ERROR ouverte ne demeure sur les aliments du lot avant verified.",
    "Chaque source est authoritative et traçable."
  ]
}
